{
  "$schema": "./schema.json",

  "refsDir": "./refs",
  "defsDir": "./defs",
  "outDir": "./out",

  "schemaUrls": {
    "Feature": "http://geojson.org/schema/Feature.json",
    "FeatureCollection": "http://geojson.org/schema/FeatureCollection.json",
    "Geometry": "http://geojson.org/schema/Geometry.json",
    "GeometryCollection": "http://geojson.org/schema/GeometryCollection.json",
    "LineString": "http://geojson.org/schema/LineString.json",
    "MultiLineString": "http://geojson.org/schema/MultiLineString.json",
    "MultiPoint": "http://geojson.org/schema/MultiPoint.json",
    "MultiPolygon": "http://geojson.org/schema/MultiPolygon.json",
    "Point": "http://geojson.org/schema/Point.json",
    "Polygon": "http://geojson.org/schema/Polygon.json",
    "TileJSON": "https://raw.githubusercontent.com/mapbox/tilejson-spec/master/3.0.0/schema.json"
  },

  "options": {
    "mode": "default",
    "jsonCheck": false,
    "allErrors": true,
    "extraFormats": true,
    "includeErrors": true,
    "requireSchema": true,
    "formatAssertion": true,
    "complexityChecks": true,
    "removeAdditional": false,
    "contentValidation": true,
    "requireValidation": true,
    "unmodifiedPrototypes": true,
    "requireStringValidation": false
  }
}
